[
    {
        "group_name": "Clustering Algorithm",
        "set_name": "Cluster A",
        "set_color": [255, 0, 0],
        "cell_id": "cell_243"
    },
    {
        "group_name": "Clustering Algorithm",
        "set_name": "Cluster A",
        "set_color": [255, 0, 0],
        "cell_id": "cell_271"
    },
    {
        "group_name": "Clustering Algorithm",
        "set_name": "Cluster A",
        "set_color": [255, 0, 0],
        "cell_id": "cell_247"
    },
    {
        "group_name": "Clustering Algorithm",
        "set_name": "Cluster A",
        "set_color": [255, 0, 0],
        "cell_id": "cell_248"
    }
]